{
  "schema_id": "taoge://commands/p0/evidence-command/v0.2",
  "schema_version": "0.2",
  "command": "record_external_result",
  "session_id": "P0H4FIXTURE-001",
  "step_id": "STEP-image-provider",
  "authorization_status": "not_authorized",
  "invocation_status": "not_invoked",
  "idempotency_key": "P0H4FIXTURE-001:image-provider-not-invoked",
  "expected_last_sequence_no": 5,
  "safe_summary": "图片 provider 未获授权，工具未发出请求"
}
