{
  "schema_id": "taoge://commands/p0/evidence-command/v0.2",
  "schema_version": "0.2",
  "command": "reconcile_orphan_artifact",
  "session_id": "P0H4FIXTURE-001",
  "step_id": "STEP-compile",
  "artifact_id": "RIN-P0H4-001",
  "artifact_type": "deterministic_final_delivery_render_input",
  "relative_path": "intermediate/p0/orphan-render-input.json",
  "input_artifact_ids": [
    "TOPIC-P0H4-001"
  ],
  "expected_sha256": "sha256:9eb05a1231e529a9e0d4192a428e9440ece3de6cfe5195683cd8cd65a6b6eccc",
  "input_digest": "sha256:1111111111111111111111111111111111111111111111111111111111111111",
  "tool_version": "fixture-compiler-v0.2",
  "action": "adopt",
  "idempotency_key": "P0H4FIXTURE-001:reconcile-render-input",
  "expected_last_sequence_no": 4,
  "safe_summary": "孤儿 render input 已按 plan、digest 和工具版本完成对账"
}
